At that time, the CLR marks it as eligible for garbage collection
CLR是什么
##################################
	mysql chapter
##################################
======= tricks
0.	What is the story behind mySql set default character set to "latin1_swedish_ci"	??
	The bloke who wrote it was co-head of a Swedish company.
1. shell环境下,mysql的执行结果和想象的有差异时,看mysql执行日志的sql语句,对比命令行输入的.
	(特别是用mysql -e 直接执行mysql语句时,且某个表字段值里带双引号)
	
2.当srting里面有database的特殊字符时，如何select?
(使用Access是必须避免的特殊字符，http://support.microsoft.com/kb/826763)
(mysql special characters in string literals, )
---
cmake install prefix mysql(-DCMAKE_INSTALL_PREFIX=../mysql_install)
vim CMakeLists.txt
vim cmake/build_configurations/compiler_options.cmake

install mysql from source code
1.mkdir mysql_self && cd mysql_self
2.wget http://cdn.mysql.com/Downloads/MySQL-5.6/mysql-5.6.10.tar.gz
3.tar -xvf mysql-5.6.10.tar.gz
4.cd mysql-5.6.10
5.mkdir ../mysql_install
6.cmake -DCMAKE_INSTALL_PREFIX=../mysql_install -DWITH_INNOBASE_STORAGE_ENGINE=1 -DDEFAULT_CHARSET=utf8 -DDEFAULT_COLLATION=utf8_general_ci
7.make
8.make install
9.cd ../mysql_instal
10. mkdir mysql(this dir is used to store mysql database data)
11. 
log-bin=/tmp/mysqlbin.log
general_log=on
general_log_file=/tmp/mysql_execute.log
datadir=/home/myUserName/learn/mysql_install/mysql
socket = /tmp/mysql.sock
user = mysql
skip-host-cache
skip-name-resolve
echo "character-set-server = utf8" >> /etc/my.cnf
echo "collation-server = utf8_general_ci" >> /etc/my.cnf
12. scripts/mysql_install_db --user=mysql --defaults-file=./my.cnf --ldata=./mysql
13. bin/mysqladmin -u root password 123456

errors
1.MySQL Error on Startup: ambiguous option '--log=/var/log/mysqld.log'
./bin/mysqld --defaults-file=/path/to/my.cnf

2.can't open the mysql.plugin table 
./bin/mysqld Table 'mysql.plugin' doesn't exist
This means that datadir is not right. 
Change it to the directory contains file ibdata1 and directory mysql/
vim my.cnf, datadir=/path/to/ibdata1/../

3.[Warning] IP address could not be resolved : Temporary failure in name resolution.
(http://serverfault.com/questions/341290/mysql-warning-ip-address-could-not-be-resolved)
Add following lines to /etc/my.cnf, then restart mysqld
[mysqld]
skip-host-cache
skip-name-resolve

4.host is not allowed to connect to this mysql server
delete user, restart mysql, create use again, then everything is OK.
---

5.enable query log my.cnf
[mysqld]
general_log = on
general_log_file=/path/to/query.log

//查一个pymysql导致查询中文失败的问题
根据日志判断,navicat发过去的是 %潇洒%,而pymysql发过去的是 乱码,所以想断点看下两者不同之处
1.对比法,navicat里面查询 select accid, name from CHARBASE WHERE NAME LIKE "%潇洒%"可以查出来
而pymysql却查询不出来
2.下载mysql源代码，捣鼓了3个小时将其编译通过并以bin/mysqld运行，将原来的数据库全部拷贝过去,新建mysql用户
3.ls sql/|grep log，找到打日志的文件,和函数,gdb -p 给函数设置断点
4.查看堆栈,找到上层的dispath_command函数
5.直接断dispatch_command,将收到的packet按字节打印,发现 潇洒 两个字,pymysql是str.encode('utf-8')发过去的,而navicat是 'gbk'编码 (e4ec c8f7)发过去的
6.将pymysql的 Connection 类里面的self.encoding直接赋值为'gbk'
7.重试,发现还是不行。现在问题变成了：两条查询在/tmp/mysql_execute.log显示出的日志都是一模一样,一个有结果,一个没结果
8.分析,mysql在进行字符串比较的时候用的是 character_set_connection, 于是就想对比下pymysql和navicat执行结果
9.p cursor.execute('show variables like "%char%"')
p cursor.fetchall() 发现pymysql character_set_connection等一系列变量(除了database创建时候是latin1)都是utf8
navicat里直接执行show variables like "%char%" 发现 character_set_connection等是latin1
10.同时也尝试了用mysql databaseName -e "select accid, name from CHARBASE WHERE NAME LIKE \"%潇洒%\"" 也没得到结果
11.在pymysql de cursor.execute()前加了一句 cursor.execute('set names "latin1"'), cursor.fetchall(), 测试OK
12.shell终端下mysql的执行语句前也加上一句 set names 'latin1'即可

总结：
1. mysql是按照 charset_set_client的编码 去解析收到的字符串,所以出现日志乱码,
第一反映是去show variables like "%char%"， show variables like "%coll%"
2. charset_set_connection和database保持一致, database是latin1的,那么set names 'latin1'

======== questions
2. press HOME keyborad, just print "~"

3. to be continued
	mysql.user privileges
	the \ character is used by the LIKE operator itself

======= advanced commands
1. backup mysql database
	mysqldump -u... -p... mydb t1 t2 t3 > mydb_tables.sql
	mysqldump databaseName > bak.sql
	mysqldump -A -uuserName -p123456 databaseName > bak.sql
	mysqldump --opt -d databaseName -h192.168.0.0 -uuserName -p > bak.sql(only table structure, no data)
	mysqldump -t databaseName -uuserName -p > bak.sql
	
	backup all databases on an IP address
	
2.recover a database
	mysql -h192... -uuserName -p123456 databaseName < /home/userName/dbBak/bak.sql

3. mysql user management
	###########
	create user 'userName'@'192.0.0.1' identified by 'password 123456';
	CREATE USER 'monty'@'localhost' IDENTIFIED BY 'some_pass';
		Why ?? using root, ERROR 1396 (HY000): Operation CREATE USER failed for 'jack'@'localhost'
		run "flush privileges;", then it is OK!
	set password for 'userName'@'192.0.0.1' = password('newpass');
	rename user 'userName'@'192.0.0.1' to 'chen'@'localhost'
	drop user 'userName'@'localhost'
	
	'zyw'这个用户有权限但是连接不上,drop user,delete from mysql.user where user='zyw' 后要重启服务器
	
	
4. Mysql user privileges management
	(################# must run 'flush privileges' after change privileges)

	grant select, insert, update, delete on testdb.* to userName@'%'

	privileges:
	create 
	alter
	drop
	references(foreign key privilege)
	create temporary
	index

	create view
	show view

	create routine(show procedure status)
	alter routine(drop a procedure)
	execute

	all privileges

	grant all on *.* to userName@'%'(还是不能访问,于是grant all on *.* to userName@'%' identified by '123456')
	grant select(id, name, score) on students.scores to userName@'%'
	grant execute on procedure testdb.procedure_add to ...
	grant execute on function testdb.fun_add to ...

	show grants for userName@localhost;

5. MYsql revoke privileges
	revoke all on *.* from userName@'%'

6. ''@'localhost' will be matched first than 'userName'@'localhost'

7. mysql -uuserName -p123456 testdb -e "show tables"

8. mysqladmin shutdown
	mysqld_safe

9. edit /etc/my.cnd(if character_set_database=latin1, and Chinese chars show as"??????")
	[client]
	default-character-set=utf8
	[mysqld]
	character-set-server=utf8
	[mysql]
	default-character-set=utf8
	
10. copy one table's data from one db to another db
	create table db2.table like db1.table
	insert into db2.table select * from db1.table
	(create table db2.table select * from db1.table, just copys the data, not index.)	

11. mysqld --log=/usr/local/mysql/log/mysqlexecute.log, 
	file not found, could not use '' for logging (error 13)
	"not found" sounds like a permission problem, chmod g+w /usr/local/mysql/log/. Solved!!!
	
12. 加@和不加有什么区别吗,@是session变量,不加是局部变量。

13.
The server character set and collation are used as default values 
if the database character set and collation are not specified in CREATE DATABASE statements. They have no other purpose.

The database character set and collation affect these aspects of server operation:

For CREATE TABLE statements, the database character set and collation are used as default values for table definitions if the table character set and collation are not specified. To override this, provide explicit CHARACTER SET and COLLATE table options.

For LOAD DATA statements that include no CHARACTER SET clause, the server uses the character set indicated by the character_set_database system variable to interpret the information in the file. To override this, provide an explicit CHARACTER SET clause.

For stored routines (procedures and functions), the database character set and collation in effect at routine creation time are used as the character set and collation of character data parameters for which the declaration includes no CHARACTER SET attribute. To override this, provide an explicit CHARACTER SET attribute.

What character set is the statement in when it leaves the client?
The server takes the character_set_client system variable to be the character set in which statements are sent by the client.

What character set should the server translate a statement to after receiving it?
For this, the server uses the character_set_connection and collation_connection system variables. It converts statements sent by the client from character_set_client to character_set_connection (except for string literals that have an introducer such as _latin1 or _utf8). collation_connection is important for comparisons of literal strings. For comparisons of strings with column values, collation_connection does not matter because columns have their own collation, which has a higher collation precedence.

What character set should the server translate to before shipping result sets back to the client?
The character_set_results system variable indicates the character set in which the server returns query results to the client. This includes result data such as column values, and result metadata such as column names.

========= mysql functions
1. mysql list built-in functions(not found yet), help + command
	help show
	help create
	help insert
	help select
	
2.	cast functions and operators
	read mysql manual carefully.(the manual says type="unsigned", date, datetime, decimal(10), signed, time, binary(1),char(5))
	cast (substr('abc_00000', 5, 5) as unsigned);
	
3.	string functions(http://dev.mysql.com/doc/refman/5.0/en/string-functions.html#function_substring-index)
	replace('E:\\d1\\d2\\d3.xml', substring_index('E:\\d1\\d2\\d3.xml', '.', 1), '')='.xml'	

4.	number functions, max(id)
insert into tableName(path, configname, id) select "C:\\windows\\", "config.xml", max(id)+1 from tableName where id > 10000	
5.	show current user
	select user();
	select database();
6.	
	

========= basic commands
1. alter (mysql basic commands)
	alter table tableName change columnName columnName bigint(20);
2. create
	create table tableName (index indexName(column1, column2)) select * from anotherTable;
	create table if not exists 
3.	update
	update table set column1 = cast(substr(column2 from 8 for 6) as unsigned)
4.	show
	show indexes from tableName		
5.	insert	
	insert into tableName(path, configname, id) select "C:\\windows\\", "config.xml", max(id)+1 from tableName where id > 10000
6.	select	
	select * from tableName where columnName like "%\\"%"
	select * from tableName where columnName like '%"%'
	select 'This is quote with ''single quote'	
	select 'This is quote with \'single quote'
	select distinct tableName, indexName from infomation_schema.statistics where table_schema = 'my_schema'
	(show the column names of a table with a simple sql query)
	select column_name from information_schema.columns where table_name='table'

7.	load data in file "~/tmp/bak.sql" into table tableName
	load data local in file "E:\bak.sql" into table tableName
	
8. change the data type of one column
	alter table tableName modify columnName float
	
9. mysql order by two columns
	select * from table_name order by level desc, type desc, `name` desc;
	
10. mysql join usage
	(http://stackoverflow.com/questions/2183373/mysql-group-by-two-columns)
	mysql> create table client(client_id integer not null primary key auto_increment, name varchar(64));
	mysql> create table portfolio (portfolio_id integer not null primary key auto_increment, client_id integer references client.id, cash decimal(10,2), stocks decimal(10,2));
	mysql> insert into client (name) values ('account1', 'account2')
	mysql> insert into portfolio (client_id, cash, stocks) values (1, 11.11, 22.22), (1, 10.11, 21.22), (2, 30.33, 40.40), (2, 40.44, 50.55);
	mysql> select * from portfolio join (select client_id, max(cash + stocks) as max
total from portfolio group by client_id) as maxima using(client_id) where cash +
 stocks = maxtotal;
+-----------+--------------+-------+--------+----------+
| client_id | portfolio_id | cash  | stocks | maxtotal |
+-----------+--------------+-------+--------+----------+
|         1 |            1 | 11.11 |  22.22 |    33.33 |
|         2 |            4 | 40.44 |  50.55 |    90.99 |
+-----------+--------------+-------+--------+----------+
2 rows in set (0.00 sec)
	
	
======== interact with shell, files
1. 	output to a file
	select column1, column2 from tableName into outfile "c:/users/file.csv" fields terminated by ',' enclosed by '"' lines terminated by "\n"
	mysql -u USERNAME --password=PASSWORD --database=DATABASE --execute='SELECT FIELD FROM TABLE LIMIT 0, 10000 ' -X > file.xml
2.		
	
========= procedure commands and scripts
1. How to create procedure?
	delimiter $$
	create procedure tempProcedure(in tableName varchar(20), in dbName varchar(100), out dbName varchar(4))
	begin
	end$$
	delimiter ;
	
	delimiter $$
	create function square_func(p_input int) returns int
	begin
	return pow(p_input, 2)
	end$$
	delimiter ;	
	set @outVar = square_func(2);
	
2. 	How to call another procedure in a procedure??
	create procedure proc_1(out para varchar(100))
	begin
		...
	end
	
	create procedure proc_2()
	begin
		call proc_1(@para);
		select @para;
	end	
	
3.	How to skip errors in procedures?(for example. 'search fuck from tableName', error 1064)
	declare continue handler for 1064 begin end;
	
4.	How to debugging procedure??
	建存储过程，call storedPrecedureName(para1, para2),结果出现错误，check the right syntax to use near NULL at line 1	
	how to debug stored procedure?如何调试存储过程
	将prepare和exexute语句注释掉（）
	建一张用于存储查询字符串的表create table tempStr(str varchar(200));
	新建一张表，将每个query string都insert into 一张临时表tempStr中(insert into tempStr values(@selectOrUpdateStr);)
	
5.	prepare stat from 'select * from ? limit 1'; Why error 1064??
	Can not pass in table names as prepared statements parameters. 
	offical documentation: Parameter markers can be used only where data values should appear, not for SQL keywords, identifies, and so forth.
	The only thing I can parametrize are fileds in where clauses and for update(update .. set id=?)
	
6. How to make an array and cycle it in mysql??
	set @zoneLists = "zone1,zone2,zone3,";
	while @zoneLists != "" do
		set @firstZone := get_first_zone_in_string(@zoneLists);
		@zoneLists = zoneLists.Replace(@firstZone, "");
	end while

7.	How to rename a mysql database?
	(For innoDB, create empty DB, then rename each table in turn into new db, then change,flush privileges)
	rename TABLE old_db.table1 to new_db.table2	
	---------------------
	using shell script:
	for eachtable in `mysql -uuserName -p123456 -h0.0.0.0 --skip-column-names -e "show tables from old_db"`
	do
		mysql -uuserName -p123456 -h0.0.0.0 -e "rename table old_db.$eachtable to new_db.$eachtable"
	done
	
8. (performance)select data from a table, where a specific field has the min value
	(Better way)select * from tableName where column = (select min(filed) from tableName)
	select * from tableName order by field asc limit 1	

9.	idString          	idNum
   sys_info_012345_a 	12346
   sys_info_012346_a 	12347
   sys_info_012347_ab 	12348
   如何replace idString column's num from idNum,将idNum中的数字替换到idString中
	1. alter table tableName add column temp varchar(128)
		update tableName set temp=concat('sys_info_0',idNum,substr(idString from 16 for length(idString)-16))
	2.update tableName set idString=replace(idString, substr(idString from 11 for 5),idNum)	
10.	How to dump "show tables" to a variable??
	Mysql Before 5.0, can not
	Mysql after 5.0, SELECT table_name from INFORMATION_SCHEMA.TABLES WHERE TABLE_SCHEMA='database_name';	
	
11. insert vietnamese to mysql use navicat(Do not do this, it will 乱码,just write a program myself)
	set names 'utf8' collate 'utf8_general_ci'
	alter table testTable CONVERT TO CHARACTER SET utf8 COLLATE utf8_general_ci
	navicat, right click the connection name, choose 'connection properties', advanced, change encoding to utf8.
	右键 连接，选连接属性，高级，编码改成65001-UTF8		
12.	How to convert latin1_swedish_ci data into utf8_general_ci?
	alter database dbName DEFAULT CHARACTER SET utf8 COLLATE utf8_general_ci
	alter table table_name CONVERT TO CHARACTER SET utf8 COLLATE utf8_general_ci		

13.	How to install mySQL-python
	pip install mysql-python fails with EnvironmentError: mysql_config not found
	sudo apt-get install libmysqlclient-dev
	
14.	How to select into outfile client side??
	经测试mysql dbName -e "select * from CHARBASE" > temp.sql,temp.sql中的数据被损坏了..还是用scp的方法吧
	mysql dbName -e "select * from CHARBASE into outfile \"/tmp/abcd.sql\""
	scp userName@host:/tmp/abcd.sql /destination
	
15. 1040 too many connections mysql
vim /etc/my.cnf
set-variable=max_connections=1000
show processlist

========= confused mysql conceptions
1.	What's the difference, @variable vs variable??加@和不加有什么区别？
		MySql has the concept of user-defined variables. They are loosely typed variables 
	that may be initialized somewhere in a session and keep their value until the session ends.
	They are prepended with an "@" sign.
	
		User-defined variables declaration : SET @var := 1, SELECT @var1 := 2
	User-defined variables are not case-sensitive in MySql 5.0 and up, but are case-sensitive before MySql 5.0	
	For SET,either := or =	can be used as assignment operator
	For SELECT , the assignment operator must be :=, because = is treated as the comparison operator= in non-SET statements.
	SELECT @maxid := id from tableName order by id limit 1;
	
		Local variables(not prepended with any prefixes) declaration: declare localVariable INT default 1;
	Local variables declaration must appear before cursor or handle declarations.
	not case-sensitive, scope is BEGIN ... END	
		
		System variables, which maybe "global variables" such as @@global.port, or "session variables" such as @@session.sql_mode, 
	these are unrelated to session-specific user-defined variables. 
	(SELECT @@version, is also a reason why using delimiter @@ is not a good idea.)
	
		The difference between a procedure variable(local variable defined in procedure) and @variable is :
	Procedure variables is reinitialized to NULL, while session-specific user-defined variables is not.	
	Local variable can not be used in prepare statements created with procedure programs.
	(Because prepared statements scope is the current session, so the statement can be executed after the procedure ends, at which point Local vars is no longer in scope)
	Local variable should not have the same name as the table column name.Mysql interprets the reference to a column as the name of localVars.
	(select local_var_same_as_table_column from tableName where local_var_same_as_table_column = local_var_same_as_table_column)
	
	example:
	create procedure test_proc()
	begin
		declare procedureVar int default 1;
		set procedureVar := procedureVar + 1;
		set @user_definedVar := @user_definedVar + 1;
		select procedureVar, @user_definedVar;
	end
	
	call test_proc()
	procedureVar     @user_definedVar
	-----------      ----------------
		2				2
		
	call test_proc()
	procedureVar	@user_definedVar
	------------	----------------
		2				3
		
2.	Multiple Indexes vs Multi-Column Indexes
	(http://stackoverflow.com/questions/179085/multiple-indexes-vs-multi-column-indexes)			
	
3.	grant all on *.* to userName@'%';然后执行create database没权限
	grant all on *.* to userName@'localhost';就有权限了
	django 123456
		
	

#####################################
access 
#####################################
0.1. 使用Access是必须避免的特殊字符，http://support.microsoft.com/kb/826763

:(  Access is not written as a multiple CPU app even though parts of it have multiple threads of execution.
:)  Use Access 查询设计视图来检测自己的语法是否正确
1. is there an equivalent to the substring function in MS Access??
	(can search "MS Access string functions")
	select distinct left(string_column, 1), tight(string_column, 2), mid(string_column, 14, 1) from table_name;
	
2. How to join on memo fields in Microsoft Access?
	SELECT table1.*, table2.*
	FROM table1, table2
	WHERE (table1.MemoField = table2.MemoField)
	
	update table1, table2
	SET table1.field1 = table2.field2
	WHERE table1.MemoField = table2.MemoField
	
	update table1
	set table1.field1=table2.field
	from table1
	left join table2
	on table1.join_column = tabl2.join_column
	where table2.field=true
	
3. concatenate two columns in an Access table
	select column1 & """" & column2 & "," & column3 from table;

4. Why access is too slow??
	"select long_string from table1"
	string temp = row.ItemArray[0].ToString()
	"insert into table2 where column1 = temp"
	
	table2 has 70000 rows, a long text column, and the operation is too slow!
	
5. Specify delimeter when exporting data from excel	

6. How to do INSERT into a table records extracted from another table
	INSERT INTO Table2(LongIntColumn2, CurrencyColumn2)
	SELECT LongIntColumn1, Avg(CurrencyColumn) as CurrencyColumn1 FROM Table1 GROUP BY LongIntColumn1
7.	access insert string的时候,string中如果包含",要将其替换为""
	包含-,替换为_
	create table [tablename]([column1] int, [column2] text)
	用[]包含表名,列名,这样表名列名中有关键词reserved words(比如'(',或者'-')的时候,也不会报错


#####################################
	excel chapter
#####################################
1. How to read excel spreadsheet in C# quickly??
http://stackoverflow.com/questions/7613898/how-to-read-an-excel-spreadsheet-in-c-sharp-quickly